{
  "$schema": "https://json-schema.org/draft/2020-12/schema",
  "$id": "https://github.com/titanarq/studentassistant/protocol/rest.sessions.captures.request.schema.json",
  "title": "rest.sessions.captures.request",
  "description": "POST /api/sessions/{id}/captures: the `metadata` JSON part of a multipart/form-data burst whose images travel as sibling parts named in `images[].part`. Idempotent on `capture_id`: a repeated id is answered `duplicate` and stores nothing.",
  "type": "object",
  "additionalProperties": false,
  "required": [
    "capture_id",
    "trigger",
    "client_time_ms",
    "images"
  ],
  "properties": {
    "capture_id": {
      "type": "string",
      "pattern": "^[0-9a-f]{8}-[0-9a-f]{4}-[0-9a-f]{4}-[0-9a-f]{4}-[0-9a-f]{12}$",
      "description": "Client-generated lowercase UUID; the idempotency key."
    },
    "trigger": {
      "enum": [
        "button",
        "command"
      ]
    },
    "command_id": {
      "type": "string",
      "pattern": "^[A-Za-z0-9][A-Za-z0-9_-]*$",
      "description": "The command message that asked for this capture, when trigger is command (ADR-0006)."
    },
    "client_time_ms": {
      "type": "integer",
      "minimum": 0,
      "description": "Client clock when the burst started, Unix epoch ms."
    },
    "images": {
      "type": "array",
      "minItems": 1,
      "items": {
        "type": "object",
        "additionalProperties": false,
        "required": [
          "part",
          "content_type",
          "width_px",
          "height_px",
          "client_time_ms"
        ],
        "properties": {
          "part": {
            "type": "string",
            "pattern": "^image_[0-9]+$",
            "description": "Name of the multipart part carrying this image's bytes."
          },
          "content_type": {
            "enum": [
              "image/jpeg",
              "image/png",
              "image/webp"
            ]
          },
          "width_px": {
            "type": "integer",
            "minimum": 1
          },
          "height_px": {
            "type": "integer",
            "minimum": 1
          },
          "client_time_ms": {
            "type": "integer",
            "minimum": 0,
            "description": "Client clock when this still was taken, Unix epoch ms."
          }
        }
      }
    }
  }
}
